{
  "schemaVersion": 1,
  "handId": "demo_h2",
  "sessionId": "demo",
  "handNumber": 2,
  "playedAt": "2026-05-29T12:02:00.000Z",
  "config": {
    "numPlayers": 4,
    "smallBlind": 1,
    "bigBlind": 2,
    "startingStackBb": 100
  },
  "heroSeat": 0,
  "seats": [
    {
      "seat": 0,
      "name": "You",
      "isHero": true,
      "startingStack": 200,
      "position": "BB",
      "persona": null
    },
    {
      "seat": 1,
      "name": "Nora (Nit)",
      "isHero": false,
      "startingStack": 200,
      "position": "UTG",
      "persona": {
        "style": "Nit",
        "skill": "Advanced"
      }
    },
    {
      "seat": 2,
      "name": "Leo (LAG)",
      "isHero": false,
      "startingStack": 200,
      "position": "BTN",
      "persona": {
        "style": "LAG",
        "skill": "Intermediate"
      }
    },
    {
      "seat": 3,
      "name": "Cleo (Station)",
      "isHero": false,
      "startingStack": 200,
      "position": "SB",
      "persona": {
        "style": "Calling Station",
        "skill": "Beginner"
      }
    }
  ],
  "heroHole": [
    "4d",
    "Qh"
  ],
  "board": [
    "Kd",
    "Qd",
    "Ks",
    "3d",
    "9d"
  ],
  "actions": [
    {
      "street": "preflop",
      "seat": 1,
      "action": "raise",
      "amount": 6
    },
    {
      "street": "preflop",
      "seat": 2,
      "action": "call",
      "amount": 6
    },
    {
      "street": "preflop",
      "seat": 3,
      "action": "raise",
      "amount": 17
    },
    {
      "street": "preflop",
      "seat": 0,
      "action": "call",
      "amount": 16
    },
    {
      "street": "preflop",
      "seat": 1,
      "action": "call",
      "amount": 12
    },
    {
      "street": "preflop",
      "seat": 2,
      "action": "call",
      "amount": 12
    },
    {
      "street": "flop",
      "seat": 3,
      "action": "bet",
      "amount": 38
    },
    {
      "street": "flop",
      "seat": 0,
      "action": "call",
      "amount": 38
    },
    {
      "street": "flop",
      "seat": 1,
      "action": "raise",
      "amount": 165
    },
    {
      "street": "flop",
      "seat": 2,
      "action": "raise",
      "amount": 182
    },
    {
      "street": "flop",
      "seat": 3,
      "action": "call",
      "amount": 144
    },
    {
      "street": "flop",
      "seat": 0,
      "action": "call",
      "amount": 144
    },
    {
      "street": "flop",
      "seat": 1,
      "action": "call",
      "amount": 17
    }
  ],
  "heroDecisions": [
    {
      "decisionId": "h2-d1",
      "street": "preflop",
      "spot": {
        "potBefore": 32,
        "toCall": 16,
        "position": "BB",
        "stackBb": 99,
        "numActiveOpponents": 3,
        "facing": "raise"
      },
      "heroAction": {
        "action": "call",
        "amount": 16
      },
      "analysis": {
        "schemaVersion": 1,
        "verdict": "mistake",
        "severity": 2,
        "conceptTags": [
          "preflop_chart_deviation",
          "call_too_wide"
        ],
        "coachingDepth": "equity",
        "gtoClaim": true,
        "assumedRange": "a typical opponent range",
        "numbers": {
          "equityPct": 19.5,
          "potOddsPct": 33.3,
          "ev": {
            "fold": 0,
            "call": -6.6,
            "raise": -13.2
          },
          "unit": "usd"
        },
        "plainExplanation": "The baseline chart says fold 4♦Q♥ from BB; your line differs. Sticking to the chart is the higher-EV default here.",
        "chart": {
          "applies": true,
          "chartAction": "fold",
          "heroDeviates": true
        }
      }
    },
    {
      "decisionId": "h2-d2",
      "street": "flop",
      "spot": {
        "potBefore": 110,
        "toCall": 38,
        "position": "BB",
        "stackBb": 91,
        "numActiveOpponents": 3,
        "facing": "raise"
      },
      "heroAction": {
        "action": "call",
        "amount": 38
      },
      "analysis": {
        "schemaVersion": 1,
        "verdict": "good",
        "severity": 0,
        "conceptTags": [
          "call_correct_price"
        ],
        "coachingDepth": "equity",
        "gtoClaim": false,
        "assumedRange": "a typical opponent range",
        "numbers": {
          "equityPct": 49.5,
          "potOddsPct": 25.7,
          "ev": {
            "fold": 0,
            "call": 35.2,
            "raise": 53.6
          },
          "unit": "usd"
        },
        "plainExplanation": "It costs you $38 to win a $148 pot — you only need to win about 26% of the time. Your hand wins ~49%. Easy call — you're getting a great price."
      }
    },
    {
      "decisionId": "h2-d3",
      "street": "flop",
      "spot": {
        "potBefore": 639,
        "toCall": 144,
        "position": "BB",
        "stackBb": 72,
        "numActiveOpponents": 3,
        "facing": "raise"
      },
      "heroAction": {
        "action": "call",
        "amount": 144
      },
      "analysis": {
        "schemaVersion": 1,
        "verdict": "good",
        "severity": 0,
        "conceptTags": [
          "call_correct_price"
        ],
        "coachingDepth": "equity",
        "gtoClaim": false,
        "assumedRange": "a typical opponent range",
        "numbers": {
          "equityPct": 52.2,
          "potOddsPct": 18.4,
          "ev": {
            "fold": 0,
            "call": 264.5,
            "raise": 345.8
          },
          "unit": "usd"
        },
        "plainExplanation": "It costs you $144 to win a $783 pot — you only need to win about 18% of the time. Your hand wins ~52%. Easy call — you're getting a great price."
      }
    }
  ],
  "outcome": {
    "winners": [
      {
        "seat": 0,
        "amount": 800
      }
    ],
    "heroNet": 600,
    "shown": [
      {
        "seat": 1,
        "cards": [
          "Kh",
          "Jc"
        ]
      },
      {
        "seat": 2,
        "cards": [
          "Qs",
          "2h"
        ]
      },
      {
        "seat": 3,
        "cards": [
          "Ah",
          "As"
        ]
      }
    ],
    "endedAtShowdown": true
  }
}