{
  "schemaVersion": 1,
  "handId": "demo_h4",
  "sessionId": "demo",
  "handNumber": 4,
  "playedAt": "2026-05-29T12:04:00.000Z",
  "config": {
    "numPlayers": 4,
    "smallBlind": 1,
    "bigBlind": 2,
    "startingStackBb": 100
  },
  "heroSeat": 0,
  "seats": [
    {
      "seat": 0,
      "name": "You",
      "isHero": true,
      "startingStack": 200,
      "position": "BTN",
      "persona": null
    },
    {
      "seat": 1,
      "name": "Nora (Nit)",
      "isHero": false,
      "startingStack": 200,
      "position": "SB",
      "persona": {
        "style": "Nit",
        "skill": "Advanced"
      }
    },
    {
      "seat": 2,
      "name": "Leo (LAG)",
      "isHero": false,
      "startingStack": 200,
      "position": "BB",
      "persona": {
        "style": "LAG",
        "skill": "Intermediate"
      }
    },
    {
      "seat": 3,
      "name": "Cleo (Station)",
      "isHero": false,
      "startingStack": 200,
      "position": "UTG",
      "persona": {
        "style": "Calling Station",
        "skill": "Beginner"
      }
    }
  ],
  "heroHole": [
    "Ts",
    "2d"
  ],
  "board": [
    "5d",
    "7h",
    "Qd",
    "9h",
    "7d"
  ],
  "actions": [
    {
      "street": "preflop",
      "seat": 3,
      "action": "call",
      "amount": 2
    },
    {
      "street": "preflop",
      "seat": 0,
      "action": "call",
      "amount": 2
    },
    {
      "street": "preflop",
      "seat": 1,
      "action": "call",
      "amount": 1
    },
    {
      "street": "preflop",
      "seat": 2,
      "action": "check",
      "amount": 0
    },
    {
      "street": "flop",
      "seat": 1,
      "action": "check",
      "amount": 0
    },
    {
      "street": "flop",
      "seat": 2,
      "action": "bet",
      "amount": 8
    },
    {
      "street": "flop",
      "seat": 3,
      "action": "call",
      "amount": 8
    },
    {
      "street": "flop",
      "seat": 0,
      "action": "call",
      "amount": 8
    },
    {
      "street": "flop",
      "seat": 1,
      "action": "fold",
      "amount": 0
    },
    {
      "street": "turn",
      "seat": 2,
      "action": "check",
      "amount": 0
    },
    {
      "street": "turn",
      "seat": 3,
      "action": "check",
      "amount": 0
    },
    {
      "street": "turn",
      "seat": 0,
      "action": "check",
      "amount": 0
    },
    {
      "street": "river",
      "seat": 2,
      "action": "check",
      "amount": 0
    },
    {
      "street": "river",
      "seat": 3,
      "action": "check",
      "amount": 0
    },
    {
      "street": "river",
      "seat": 0,
      "action": "check",
      "amount": 0
    }
  ],
  "heroDecisions": [
    {
      "decisionId": "h4-d1",
      "street": "preflop",
      "spot": {
        "potBefore": 5,
        "toCall": 2,
        "position": "BTN",
        "stackBb": 100,
        "numActiveOpponents": 3,
        "facing": "unopened"
      },
      "heroAction": {
        "action": "call",
        "amount": 2
      },
      "analysis": {
        "schemaVersion": 1,
        "verdict": "mistake",
        "severity": 2,
        "conceptTags": [
          "preflop_chart_deviation",
          "call_too_wide"
        ],
        "coachingDepth": "equity",
        "gtoClaim": true,
        "assumedRange": "a typical opponent range",
        "numbers": {
          "equityPct": 16.6,
          "potOddsPct": 28.6,
          "ev": {
            "fold": 0,
            "call": -0.8,
            "raise": -1.8
          },
          "unit": "usd"
        },
        "plainExplanation": "By the odds, your equity (your share of the pot — how often you win) with T♠2♦ is about 17% to win against the 3 opponents still in; the math favors folding from BTN instead, and your line differs from that higher-EV standard play.",
        "chart": {
          "applies": true,
          "chartAction": "fold",
          "heroDeviates": true
        },
        "explanationInput": {
          "kind": "preflop",
          "action": "call",
          "potBefore": 5,
          "toCall": 2,
          "equityPct": 16.6,
          "potOddsPct": 28.6,
          "chartAction": "fold",
          "heroDeviates": true,
          "position": "BTN",
          "hand": [
            "Ts",
            "2d"
          ],
          "numActiveOpponents": 3,
          "board": [],
          "street": "preflop"
        }
      }
    },
    {
      "decisionId": "h4-d2",
      "street": "flop",
      "spot": {
        "potBefore": 24,
        "toCall": 8,
        "position": "BTN",
        "stackBb": 99,
        "numActiveOpponents": 3,
        "facing": "raise"
      },
      "heroAction": {
        "action": "call",
        "amount": 8
      },
      "analysis": {
        "schemaVersion": 1,
        "verdict": "mistake",
        "severity": 3,
        "conceptTags": [
          "call_too_wide"
        ],
        "coachingDepth": "equity",
        "gtoClaim": false,
        "assumedRange": "a typical opponent range",
        "numbers": {
          "equityPct": 7,
          "potOddsPct": 25,
          "ev": {
            "fold": 0,
            "call": -5.8,
            "raise": -12.1
          },
          "unit": "usd"
        },
        "plainExplanation": "It costs you $8 to win a $32 pot — you only need to win about 25% of the time. Your hand wins ~7%. You're calling too wide — fold and save the chips.",
        "explanationInput": {
          "kind": "price",
          "action": "call",
          "potBefore": 24,
          "toCall": 8,
          "equityPct": 7,
          "potOddsPct": 25,
          "position": "BTN",
          "hand": [
            "Ts",
            "2d"
          ],
          "numActiveOpponents": 3,
          "board": [
            "5d",
            "7h",
            "Qd"
          ],
          "street": "flop"
        }
      }
    },
    {
      "decisionId": "h4-d3",
      "street": "turn",
      "spot": {
        "potBefore": 32,
        "toCall": 0,
        "position": "BTN",
        "stackBb": 95,
        "numActiveOpponents": 2,
        "facing": "unopened"
      },
      "heroAction": {
        "action": "check",
        "amount": 0
      },
      "analysis": {
        "schemaVersion": 1,
        "verdict": "good",
        "severity": 0,
        "conceptTags": [],
        "coachingDepth": "equity",
        "gtoClaim": false,
        "assumedRange": "a typical opponent range",
        "numbers": {
          "equityPct": 1.4,
          "potOddsPct": 0,
          "ev": {
            "fold": 0,
            "call": 0.5,
            "raise": -30.6
          },
          "unit": "usd"
        },
        "plainExplanation": "Checking is fine here — you only win about 1%, so there's little to bet for.",
        "explanationInput": {
          "kind": "valuecheck",
          "action": "check",
          "potBefore": 32,
          "toCall": 0,
          "equityPct": 1.4,
          "potOddsPct": 0,
          "position": "BTN",
          "hand": [
            "Ts",
            "2d"
          ],
          "numActiveOpponents": 2,
          "board": [
            "5d",
            "7h",
            "Qd",
            "9h",
            "7d"
          ],
          "street": "turn"
        }
      }
    },
    {
      "decisionId": "h4-d4",
      "street": "river",
      "spot": {
        "potBefore": 32,
        "toCall": 0,
        "position": "BTN",
        "stackBb": 95,
        "numActiveOpponents": 2,
        "facing": "unopened"
      },
      "heroAction": {
        "action": "check",
        "amount": 0
      },
      "analysis": {
        "schemaVersion": 1,
        "verdict": "good",
        "severity": 0,
        "conceptTags": [],
        "coachingDepth": "equity",
        "gtoClaim": false,
        "assumedRange": "a typical opponent range",
        "numbers": {
          "equityPct": 2.5,
          "potOddsPct": 0,
          "ev": {
            "fold": 0,
            "call": 0.8,
            "raise": -29.6
          },
          "unit": "usd"
        },
        "plainExplanation": "Checking is fine here — you only win about 3%, so there's little to bet for.",
        "explanationInput": {
          "kind": "valuecheck",
          "action": "check",
          "potBefore": 32,
          "toCall": 0,
          "equityPct": 2.5,
          "potOddsPct": 0,
          "position": "BTN",
          "hand": [
            "Ts",
            "2d"
          ],
          "numActiveOpponents": 2,
          "board": [
            "5d",
            "7h",
            "Qd",
            "9h",
            "7d"
          ],
          "street": "river"
        }
      }
    }
  ],
  "outcome": {
    "winners": [
      {
        "seat": 0,
        "amount": 16
      },
      {
        "seat": 3,
        "amount": 16
      }
    ],
    "heroNet": 6,
    "shown": [
      {
        "seat": 2,
        "cards": [
          "4c",
          "3d"
        ]
      },
      {
        "seat": 3,
        "cards": [
          "Td",
          "8s"
        ]
      }
    ],
    "endedAtShowdown": true
  }
}